{
  "$schema": "http://json-schema.org/draft-07/schema#",
  "$id": "task.schema.json",
  "title": "Unitary UI versioned LLM task",
  "type": "object",
  "additionalProperties": false,
  "required": [
    "$schema",
    "id",
    "version",
    "description",
    "promptFragments",
    "contextProvider",
    "impactGlobs",
    "allowedWriteGlobs",
    "validators"
  ],
  "properties": {
    "$schema": { "type": "string", "const": "../../task.schema.json" },
    "id": {
      "type": "string",
      "pattern": "^[a-z0-9]+(?:-[a-z0-9]+)*$"
    },
    "version": { "type": "integer", "minimum": 1 },
    "description": { "type": "string", "minLength": 1 },
    "promptFragments": {
      "type": "array",
      "minItems": 1,
      "uniqueItems": true,
      "items": {
        "type": "string",
        "pattern": "^\\.agents/[A-Za-z0-9._/-]+\\.md$"
      }
    },
    "contextProvider": {
      "type": "string",
      "enum": ["docs-push"]
    },
    "impactGlobs": {
      "type": "array",
      "minItems": 1,
      "uniqueItems": true,
      "items": { "type": "string", "minLength": 1 }
    },
    "allowedWriteGlobs": {
      "type": "array",
      "minItems": 1,
      "uniqueItems": true,
      "items": { "type": "string", "minLength": 1 }
    },
    "validators": {
      "type": "array",
      "minItems": 1,
      "uniqueItems": true,
      "items": {
        "type": "string",
        "pattern": "^[a-z0-9]+(?:-[a-z0-9]+)*$"
      }
    }
  }
}
